{
  "$schema": "https://json-schema.org/draft/2020-12/schema",
  "$id": "https://ryuki.io/schemas/security-contracts/v1/control-trace-status-overlay.schema.json",
  "title": "Ryuki ControlTrace repository implementation status overlay",
  "description": "Strict repository-only tracking metadata joined to one exact ControlTrace artifact by the security-conformance validator. This overlay records implementation progress and does not assert production acceptance or satisfy runtime, deployment, or external evidence requirements.",
  "type": "object",
  "additionalProperties": false,
  "required": [
    "$schema",
    "contract_kind",
    "schema_version",
    "document_id",
    "document_version",
    "authority_scope",
    "status_assurance",
    "control_trace_ref",
    "rows"
  ],
  "properties": {
    "$schema": {
      "const": "https://ryuki.io/schemas/security-contracts/v1/control-trace-status-overlay.schema.json"
    },
    "contract_kind": {
      "const": "ControlTraceStatusOverlay"
    },
    "schema_version": {
      "const": 1
    },
    "document_id": {
      "const": "control-trace-status-overlay:ryuki-security-boundary-v1"
    },
    "document_version": {
      "const": 1
    },
    "authority_scope": {
      "description": "Repository implementation tracking only; never production acceptance or proof of runtime, deployment, operator, or external evidence.",
      "const": "repository-implementation-tracking-only"
    },
    "status_assurance": {
      "description": "Implementation statuses are source-audited declarations only. They are not revision-bound conformance receipts and therefore cannot establish runtime, deployment, or production acceptance.",
      "const": "source-audited-declaration-without-conformance-receipt"
    },
    "control_trace_ref": {
      "$ref": "#/$defs/controlTraceReference"
    },
    "rows": {
      "type": "array",
      "minItems": 1,
      "maxItems": 1000,
      "uniqueItems": true,
      "items": {
        "$ref": "#/$defs/statusRow"
      }
    }
  },
  "$defs": {
    "semanticVersion": {
      "type": "string",
      "pattern": "^(0|[1-9][0-9]*)\\.(0|[1-9][0-9]*)\\.(0|[1-9][0-9]*)(?:[-+][A-Za-z0-9.-]+)?$"
    },
    "identifier": {
      "type": "string",
      "minLength": 3,
      "maxLength": 128,
      "pattern": "^[A-Za-z0-9][A-Za-z0-9._:-]*$"
    },
    "controlId": {
      "type": "string",
      "pattern": "^SB-[A-Z][A-Z0-9]*-[0-9]{2}[A-Z]?$"
    },
    "rawSha256": {
      "description": "SHA-256 of the exact raw ControlTrace artifact bytes, with no newline, encoding, or JSON canonicalization transformation; encoded as sha256: plus lowercase hexadecimal.",
      "type": "string",
      "pattern": "^sha256:[a-f0-9]{64}$",
      "not": {
        "const": "sha256:0000000000000000000000000000000000000000000000000000000000000000"
      }
    },
    "controlTraceReference": {
      "type": "object",
      "additionalProperties": false,
      "required": [
        "document_id",
        "document_version",
        "ledger_id",
        "ledger_version",
        "raw_sha256"
      ],
      "properties": {
        "document_id": {
          "const": "control-trace:ryuki-security-boundary-v1"
        },
        "document_version": {
          "type": "integer",
          "minimum": 1
        },
        "ledger_id": {
          "$ref": "#/$defs/identifier"
        },
        "ledger_version": {
          "$ref": "#/$defs/semanticVersion"
        },
        "raw_sha256": {
          "$ref": "#/$defs/rawSha256"
        }
      }
    },
    "repositoryPath": {
      "description": "Normalized repository-relative path. Filesystem confinement, regular-file existence, and symlink-safe resolution are enforced by the security-conformance validator.",
      "type": "string",
      "minLength": 1,
      "maxLength": 512,
      "pattern": "^[A-Za-z0-9_.-]+(?:/[A-Za-z0-9_.-]+)*$",
      "not": {
        "pattern": "(?:^|/)\\.\\.?(?:/|$)"
      }
    },
    "repositoryPathList": {
      "type": "array",
      "maxItems": 512,
      "uniqueItems": true,
      "items": {
        "$ref": "#/$defs/repositoryPath"
      }
    },
    "blocker": {
      "type": "object",
      "additionalProperties": false,
      "required": [
        "kind",
        "detail"
      ],
      "properties": {
        "kind": {
          "type": "string",
          "enum": [
            "repository_implementation",
            "runtime_evidence",
            "deployment_evidence",
            "external_access",
            "platform_decision"
          ]
        },
        "detail": {
          "type": "string",
          "minLength": 3,
          "maxLength": 2000
        }
      }
    },
    "statusRow": {
      "type": "object",
      "additionalProperties": false,
      "required": [
        "trace_id",
        "implementation_status",
        "source_paths",
        "migration_paths",
        "test_paths",
        "blockers",
        "dependency_control_ids"
      ],
      "properties": {
        "trace_id": {
          "$ref": "#/$defs/identifier"
        },
        "implementation_status": {
          "type": "string",
          "enum": [
            "not_implemented",
            "partial",
            "implemented"
          ]
        },
        "source_paths": {
          "$ref": "#/$defs/repositoryPathList"
        },
        "migration_paths": {
          "$ref": "#/$defs/repositoryPathList"
        },
        "test_paths": {
          "$ref": "#/$defs/repositoryPathList"
        },
        "blockers": {
          "type": "array",
          "maxItems": 64,
          "uniqueItems": true,
          "items": {
            "$ref": "#/$defs/blocker"
          }
        },
        "dependency_control_ids": {
          "type": "array",
          "maxItems": 256,
          "uniqueItems": true,
          "items": {
            "$ref": "#/$defs/controlId"
          }
        }
      }
    }
  }
}
