{
  "$schema": "https://ryuki.io/schemas/security-contracts/v1/control-trace-status-overlay.schema.json",
  "contract_kind": "ControlTraceStatusOverlay",
  "schema_version": 1,
  "document_id": "control-trace-status-overlay:ryuki-security-boundary-v1",
  "document_version": 1,
  "authority_scope": "repository-implementation-tracking-only",
  "status_assurance": "source-audited-declaration-without-conformance-receipt",
  "control_trace_ref": {
    "document_id": "control-trace:ryuki-security-boundary-v1",
    "document_version": 2,
    "ledger_id": "ryuki-security-boundary",
    "ledger_version": "1.1.0",
    "raw_sha256": "sha256:b905dc693d18df58ef053abf99f25a6ba756d20795ff7b6587c05e756c7fbe32"
  },
  "rows": [
    {
      "trace_id": "TRACE-SB-BOUND-01-AC-040",
      "implementation_status": "partial",
      "source_paths": [
        "catalog/security-contracts/v1/action-resource-registry.implementation.json",
        "sources/ryuki-engine/src/authorization.rs",
        "sources/ryuki-api/src/request_authority.rs",
        "sources/ryuki-api/src/repos/requests.rs",
        "sources/ryuki-api/src/contracts.rs",
        "sources/ryuki-api/src/security_contracts.rs"
      ],
      "migration_paths": [
        "migrations/194_request_resource_version.sql"
      ],
      "test_paths": [
        "sources/ryuki-engine/src/authorization.rs",
        "sources/ryuki-api/src/repos/requests.rs",
        "sources/ryuki-api/src/contracts.rs",
        "sources/ryuki-api/src/security_contracts.rs"
      ],
      "blockers": [
        {
          "kind": "repository_implementation",
          "detail": "Sealed kernel permits and QueryPermit collection filters cover request.read and request.list, but protected repositories, query builders, and transitions outside that slice still use legacy capability or raw-predicate paths; obligation receipts and currentness bindings are not enforced end to end for the full action/resource inventory."
        }
      ],
      "dependency_control_ids": []
    },
    {
      "trace_id": "TRACE-SB-BOUND-02-AC-041",
      "implementation_status": "partial",
      "source_paths": [
        "sources/ryuki-api/src/main.rs"
      ],
      "migration_paths": [],
      "test_paths": [
        "sources/ryuki-api/src/main.rs"
      ],
      "blockers": [
        {
          "kind": "repository_implementation",
          "detail": "Admission rejects simultaneous selected cookie, session-header, and parsed Authorization carriers, but does not implement the complete carrier-pair, duplicate-Authorization, provider-hint, ambiguous-prefix, DPoP, and mTLS-composite matrix required by AC-041."
        },
        {
          "kind": "runtime_evidence",
          "detail": "The named security_conformance::ac_041 fixture and a revision-bound execution receipt are absent."
        }
      ],
      "dependency_control_ids": []
    },
    {
      "trace_id": "TRACE-SB-IDL-01-AC-004",
      "implementation_status": "partial",
      "source_paths": [
        "sources/ryuki-api/src/authenticator_runtime.rs",
        "sources/ryuki-api/src/security_contracts.rs",
        "sources/ryuki-core/src/security_profile.rs"
      ],
      "migration_paths": [
        "migrations/201_authenticator_runtime_provenance.sql"
      ],
      "test_paths": [
        "sources/ryuki-api/src/authenticator_runtime.rs",
        "sources/ryuki-api/src/security_contracts.rs"
      ],
      "blockers": [
        {
          "kind": "repository_implementation",
          "detail": "The retained runtime binds one exact Entra authority and rejects generic OIDC before construction, but there is no common versioned Authenticator/CredentialEvidence interface or registry dispatch across multiple admitted implementations."
        },
        {
          "kind": "runtime_evidence",
          "detail": "The standards-only non-Entra multi-provider security_conformance::ac_004 fixture and execution receipt are absent."
        }
      ],
      "dependency_control_ids": []
    },
    {
      "trace_id": "TRACE-SB-AUTH-14-AC-041",
      "implementation_status": "partial",
      "source_paths": [
        "sources/ryuki-api/src/main.rs"
      ],
      "migration_paths": [],
      "test_paths": [
        "sources/ryuki-api/src/main.rs"
      ],
      "blockers": [
        {
          "kind": "repository_implementation",
          "detail": "Credential selection is failure-final for the currently parsed session, cookie, and bearer paths, but coverage and implementation are incomplete for duplicate headers, provider hints, ambiguous prefixes, every carrier pair, and configured composite proof profiles."
        },
        {
          "kind": "runtime_evidence",
          "detail": "The named security_conformance::ac_041 fixture and a revision-bound execution receipt are absent."
        }
      ],
      "dependency_control_ids": []
    },
    {
      "trace_id": "TRACE-SB-AUTH-15-AC-041",
      "implementation_status": "partial",
      "source_paths": [
        "sources/ryuki-api/src/authenticator_runtime.rs",
        "sources/ryuki-api/src/entra_auth.rs",
        "sources/ryuki-api/src/identity_authority.rs",
        "sources/ryuki-api/src/oidc_callback.rs"
      ],
      "migration_paths": [
        "migrations/201_authenticator_runtime_provenance.sql"
      ],
      "test_paths": [
        "sources/ryuki-api/src/authenticator_runtime.rs",
        "sources/ryuki-api/src/entra_auth.rs",
        "sources/ryuki-api/src/identity_authority.rs",
        "sources/ryuki-api/src/oidc_callback.rs"
      ],
      "blockers": [
        {
          "kind": "repository_implementation",
          "detail": "Exact provider/configuration/origin provenance is retained for the current Entra path, but simultaneous provider resolution and collision isolation for issuer, kid, subject, audience, client id, discovery, JWKS, and replay caches are not implemented."
        },
        {
          "kind": "runtime_evidence",
          "detail": "The named security_conformance::ac_041 collision/conflict fixture and execution receipt are absent."
        }
      ],
      "dependency_control_ids": []
    },
    {
      "trace_id": "TRACE-SB-AUTH-16-AC-043",
      "implementation_status": "partial",
      "source_paths": [
        "catalog/security-contracts/v1/provider-registry.schema.json",
        "sources/ryuki-api/src/entra_sso.rs",
        "sources/ryuki-api/src/oidc_callback.rs",
        "sources/ryuki-api/src/repos/oidc_login_states.rs"
      ],
      "migration_paths": [
        "migrations/090_oidc_login_states.sql",
        "migrations/091_oidc_login_state_binding.sql",
        "migrations/164_oidc_login_state_admission.sql",
        "migrations/201_authenticator_runtime_provenance.sql"
      ],
      "test_paths": [
        "sources/ryuki-api/src/entra_sso.rs",
        "sources/ryuki-api/src/oidc_callback.rs",
        "sources/ryuki-api/src/repos/oidc_login_states.rs"
      ],
      "blockers": [
        {
          "kind": "repository_implementation",
          "detail": "The Entra BFF path implements authorization code, PKCE S256, state, nonce, and server-side exchange, while native/public, device, and service client profile runtimes and their prohibited-grant/redirect negative suites are absent."
        },
        {
          "kind": "runtime_evidence",
          "detail": "The named security_conformance::ac_043 multi-profile fixture and execution receipt are absent."
        }
      ],
      "dependency_control_ids": []
    },
    {
      "trace_id": "TRACE-SB-AUTH-17-AC-044",
      "implementation_status": "not_implemented",
      "source_paths": [
        "catalog/local-auth-contract.yaml",
        "catalog/security-contracts/v1/provider-registry.schema.json"
      ],
      "migration_paths": [],
      "test_paths": [],
      "blockers": [
        {
          "kind": "repository_implementation",
          "detail": "Only declarative schema/contract references exist; no WebAuthn enrollment, exact RP/origin verification, one-time challenge storage, authenticator lifecycle, purpose isolation, recovery, or break-glass ceremony runtime exists."
        },
        {
          "kind": "runtime_evidence",
          "detail": "The named security_conformance::ac_044 passkey fixture and execution receipt are absent."
        }
      ],
      "dependency_control_ids": []
    },
    {
      "trace_id": "TRACE-SB-IDL-02-AC-004",
      "implementation_status": "partial",
      "source_paths": [
        "catalog/security-contracts/v1/provider-registry.schema.json",
        "catalog/security-contracts/v1/provider-registry.implementation.json",
        "sources/ryuki-api/src/security_contracts.rs",
        "sources/ryuki-core/src/security_profile.rs"
      ],
      "migration_paths": [],
      "test_paths": [
        "sources/ryuki-api/src/security_contracts.rs",
        "sources/ryuki-api/tests/security_startup_process.rs"
      ],
      "blockers": [
        {
          "kind": "repository_implementation",
          "detail": "The closed schema, immutable implementation fixture, lifecycle/reference validation, digest binding, legacy conflict rejection, and startup validation are present, but the checked-in registry activates only a non-production static dry-run fixture and does not provide the AC-004 multi-provider adapter proof."
        },
        {
          "kind": "runtime_evidence",
          "detail": "The named security_conformance::ac_004 fixture and a revision-bound execution receipt are absent."
        }
      ],
      "dependency_control_ids": []
    },
    {
      "trace_id": "TRACE-SB-EXT-04-AC-050",
      "implementation_status": "partial",
      "source_paths": [
        "sources/ryuki-runner/src/exec.rs",
        "deploy/kubernetes/base/deployments.yaml",
        "deploy/kubernetes/base/networkpolicies.yaml"
      ],
      "migration_paths": [],
      "test_paths": [
        "sources/ryuki-runner/src/exec.rs",
        "scripts/validator-rs/src/kubernetes_manifest.rs"